<?xml version="1.0" encoding="UTF-8"?>
<!-- XML Sample Message of message hierarchy                                          -->
<!-- Message:             ADC PUR Invoices Received Details v1.0 Rev. 5               -->
<!-- Transaction:         AA - Audit Data Collection Rev. 271                         -->
<!-- Datamodel:           Audit Data Collection Datamodel, version HEAD Rev. 347      -->
<!-- XML tagset used:     AdcsML                                                      -->
<!-- Generated at:        02-05-2021 16:04:27                                         -->
<!-- Generated using:     EC-Design 2.5.0 (http://www.ec-design.nl)                   -->
<!-- Generated by:        Jan Vrijenhoek (Digitect)                                   -->
<!-- Organisation:        Digitect B.V. (Digitect)                                    -->
<!-- NOTE:    This sample message was generated automatically: manual modifications will be lost -->
<AdcPurInvoicesReceivedDetails xsi:schemaLocation="http://schemas.iso.org/AdcsML/Messages/AdcPurInvoicesReceivedDetails-v1 AdcPurInvoicesReceivedDetails-v1.0.xsd"
		xmlns="http://schemas.iso.org/AdcsML/Messages/AdcPurInvoicesReceivedDetails-v1"
		xmlns:xsi="http://www.w3.org/2001/XMLSchema-instance">
	<PurInvoiRcvdDtls>
		<InvoiId>I001</InvoiId>
		<InvoiLnId>1</InvoiLnId>
		<InvoiLnNr>1</InvoiLnNr>
		<OrdId>ORD001</OrdId>
		<OrdLnId>1</OrdLnId>
		<PrdctId>PRD001</PrdctId>
		<BasicUomQt>100.0000</BasicUomQt>
		<BasicUomCd>KG</BasicUomCd>
		<InvoiQt>100.0000</InvoiQt>
		<UomCd>KG</UomCd>
		<TaxExclUnitPrice>80.00000000</TaxExclUnitPrice>
		<TaxInclUnitPrice>100.00000000</TaxInclUnitPrice>
		<TaxExclAmt>8000.0000</TaxExclAmt>
		<TaxInclAmt>10000.0000</TaxInclAmt>
		<InvoiLnTrAmt>10000.0000</InvoiLnTrAmt>
		<GrpCd>GR1</GrpCd>
		<GlLnDbAcntNr>ACC123456789</GlLnDbAcntNr>
		<GlLnCrAcntNr>ACC123456789</GlLnCrAcntNr>
		<Tax>
			<TaxTypCd>TAX01</TaxTypCd>
			<TaxTrAmt>10000.0000</TaxTrAmt>
			<GlTaxDbAcntNr>ACC123456789</GlTaxDbAcntNr>
			<GlTaxCrAcntNr>ACC123456789</GlTaxCrAcntNr>
		</Tax>
		<BusSg>
			<BusSgCd>1234</BusSgCd>
		</BusSg>
	</PurInvoiRcvdDtls>
</AdcPurInvoicesReceivedDetails>
